{
  "schema_version": "1.0.0",
  "repository": "https://github.com/SonSangjoon/coffee-chat",
  "release": {
    "version": "1.1.0",
    "source_ref": "refs/tags/v1.1.0",
    "release_digest": "sha256:edc8559432e19c0593ae918d220f2f9e35e52723b3f1ee1b02165731ef6a6481"
  },
  "files": [
    {
      "path": "./.agents/plugins/marketplace.json",
      "mode": "100644",
      "engine_audience": "instance",
      "engine_ownership": "generated",
      "disposition": "replace-instance-generated",
      "binding": {
        "kind": "content",
        "digest": "sha256:e416a10d9708a4ed5915704ede2f7d32f6554ddeb996fffcb70d005de94404be"
      }
    },
    {
      "path": "./.claude-plugin/marketplace.json",
      "mode": "100644",
      "engine_audience": "instance",
      "engine_ownership": "generated",
      "disposition": "replace-instance-generated",
      "binding": {
        "kind": "content",
        "digest": "sha256:cd1bc7e1b477195829965e7e8f6f8c3ad18e3432444f08bcd2fa05b00ce01766"
      }
    },
    {
      "path": "./.claude-plugin/plugin.json",
      "mode": "100644",
      "engine_audience": "instance",
      "engine_ownership": "generated",
      "disposition": "replace-instance-generated",
      "binding": {
        "kind": "content",
        "digest": "sha256:46ae25dc13593d307767810f3991a951d1c1e3979634b9386f97059cc79355ea"
      }
    },
    {
      "path": "./.codex-plugin/plugin.json",
      "mode": "100644",
      "engine_audience": "instance",
      "engine_ownership": "generated",
      "disposition": "replace-instance-generated",
      "binding": {
        "kind": "content",
        "digest": "sha256:0f7f2c36aea86eb04ab560c8f9a7f5a1a6cce00be3619ce7d9ffb8f77cd27984"
      }
    },
    {
      "path": "./.coffee-chat/generated-files.json",
      "mode": "100644",
      "engine_audience": "instance",
      "engine_ownership": "generated",
      "disposition": "replace-instance-generated",
      "binding": {
        "kind": "content",
        "digest": "sha256:51bbe1a23536091cec68b2593842b7f82764c1d921ca93211a0361d0d12fb996"
      }
    },
    {
      "path": "./.editorconfig",
      "mode": "100644",
      "engine_audience": "instance",
      "engine_ownership": "source",
      "disposition": "adopt-engine-source",
      "binding": {
        "kind": "content",
        "digest": "sha256:a6b98ea7cb6d61ed8d430dd0dffa46c87012b5cf859d4ce7207898954951fdcd"
      }
    },
    {
      "path": "./.gitattributes",
      "mode": "100644",
      "engine_audience": "instance",
      "engine_ownership": "source",
      "disposition": "adopt-engine-source",
      "binding": {
        "kind": "content",
        "digest": "sha256:8a0f8488eb7c7da84260209230d7982c1f80d4c8745b84ccbe97c247df24c0a6"
      }
    },
    {
      "path": "./.github/workflows/ci.yml",
      "mode": "100644",
      "engine_audience": "instance",
      "engine_ownership": "source",
      "disposition": "adopt-engine-source",
      "binding": {
        "kind": "content",
        "digest": "sha256:52b3bdc20797149feef8db028d9c33cb43d76783607d6eb99c0fe72eddf0b683"
      }
    },
    {
      "path": "./.github/workflows/codeql.yml",
      "mode": "100644",
      "engine_audience": "instance",
      "engine_ownership": "generated",
      "disposition": "replace-instance-generated",
      "binding": {
        "kind": "content",
        "digest": "sha256:9847d44c9841ccedd4fc0780c08015f1371e79bc93da8d3693ab5b6fe2099c98"
      }
    },
    {
      "path": "./.github/workflows/pages.yml",
      "mode": "100644",
      "engine_audience": "instance",
      "engine_ownership": "generated",
      "disposition": "replace-instance-generated",
      "binding": {
        "kind": "content",
        "digest": "sha256:8b586216f6e8cf3cb4a118f5d93f2713143b82d70698a5b910c842b58a0cb32c"
      }
    },
    {
      "path": "./.gitignore",
      "mode": "100644",
      "engine_audience": "instance",
      "engine_ownership": "source",
      "disposition": "adopt-engine-source",
      "binding": {
        "kind": "content",
        "digest": "sha256:8c1a0bf3df5030eb6d06659284c18b722a3bc3581ee5954730f0d2d7e42190fa"
      }
    },
    {
      "path": "./.gitleaks.toml",
      "mode": "100644",
      "engine_audience": "instance",
      "engine_ownership": "source",
      "disposition": "adopt-engine-source",
      "binding": {
        "kind": "content",
        "digest": "sha256:4cb73cbd6e7a30e9a4a4d793ff7cb29d31063345e6917f32bfb3f6cbe614b48d"
      }
    },
    {
      "path": "./.node-version",
      "mode": "100644",
      "engine_audience": "instance",
      "engine_ownership": "source",
      "disposition": "adopt-engine-source",
      "binding": {
        "kind": "content",
        "digest": "sha256:0667c9be2ca8fad9083f936776a81b73fb1c81e32f30cb4da5460f470a09f1c7"
      }
    },
    {
      "path": "./.pre-commit-config.yaml",
      "mode": "100644",
      "engine_audience": "instance",
      "engine_ownership": "source",
      "disposition": "adopt-engine-source",
      "binding": {
        "kind": "content",
        "digest": "sha256:2b5ea92fa21097814724f5e3f3c94dfef6188900be2ef385a2c034ee935941ed"
      }
    },
    {
      "path": "./.prettierignore",
      "mode": "100644",
      "engine_audience": "instance",
      "engine_ownership": "source",
      "disposition": "adopt-engine-source",
      "binding": {
        "kind": "content",
        "digest": "sha256:aa55697893fb2a053cd00aa9024e38ff8668659d220dbefc43b78a8e61bb21c2"
      }
    },
    {
      "path": "./AGENTS.md",
      "mode": "100644",
      "engine_audience": "instance",
      "engine_ownership": "generated",
      "disposition": "replace-instance-generated",
      "binding": {
        "kind": "content",
        "digest": "sha256:59f9d7f9794035845c956e3accf5b98d81d3677a43edadac522da271d1f7d251"
      }
    },
    {
      "path": "./CLAUDE.md",
      "mode": "100644",
      "engine_audience": "instance",
      "engine_ownership": "generated",
      "disposition": "replace-instance-generated",
      "binding": {
        "kind": "content",
        "digest": "sha256:336cc4fbf19beaada7ccf9986414fa91851a8d7a07dfb3ccbe800a69eed0ab49"
      }
    },
    {
      "path": "./CONTENT_LICENSE.md",
      "mode": "100644",
      "engine_audience": "instance",
      "engine_ownership": "authored",
      "disposition": "replace-instance-authored",
      "binding": {
        "kind": "content",
        "digest": "sha256:1bda522f44c007a0cd86c688d52278074aac452410c3456114511fb0cca72a21"
      }
    },
    {
      "path": "./LICENSE",
      "mode": "100644",
      "engine_audience": "instance",
      "engine_ownership": "source",
      "disposition": "adopt-engine-source",
      "binding": {
        "kind": "content",
        "digest": "sha256:4e877a766f8f5ea05b55cd7447e272c9307e892014c573704a4b9f2c7146a0c0"
      }
    },
    {
      "path": "./README.ko.md",
      "mode": "100644",
      "engine_audience": "instance",
      "engine_ownership": "generated",
      "disposition": "replace-instance-generated",
      "binding": {
        "kind": "content",
        "digest": "sha256:63966f46222652fe170014b5ea578361246a6e690c0f3f12dd786721d169a0a0"
      }
    },
    {
      "path": "./README.md",
      "mode": "100644",
      "engine_audience": "instance",
      "engine_ownership": "generated",
      "disposition": "replace-instance-generated",
      "binding": {
        "kind": "content",
        "digest": "sha256:a2ebfd77ee38a8448fee6eda679a24b65a3e3df9730f0aeebc3cfb87d9626f6e"
      }
    },
    {
      "path": "./astro.config.mjs",
      "mode": "100644",
      "engine_audience": "instance",
      "engine_ownership": "source",
      "disposition": "adopt-engine-source",
      "binding": {
        "kind": "content",
        "digest": "sha256:6756d1518872b9a170b8585a0033e103c54a81860517812ac1ba8d64344c05ec"
      }
    },
    {
      "path": "./coffee-chat.json",
      "mode": "100644",
      "engine_audience": "instance",
      "engine_ownership": "authored",
      "disposition": "replace-instance-authored",
      "binding": {
        "kind": "content",
        "digest": "sha256:dd8c970af312d471a63da569a9bfbc523e856ae8c0aa3dc0ecaa5251f3746949"
      }
    },
    {
      "path": "./docs/assets/readme/coffee-chat-cover.png",
      "mode": "100644",
      "engine_audience": "instance",
      "engine_ownership": "source",
      "disposition": "adopt-engine-source",
      "binding": {
        "kind": "content",
        "digest": "sha256:88cf9c695c7793ef1a2ef28a1ad528c5b40ec4c6aed7e53495211d1a36ad48d9"
      }
    },
    {
      "path": "./docs/assets/readme/coffee-chat-flow.en.png",
      "mode": "100644",
      "engine_audience": "instance",
      "engine_ownership": "source",
      "disposition": "adopt-engine-source",
      "binding": {
        "kind": "content",
        "digest": "sha256:399aeedde8920153d7c2fe9cc2d62d26ecc07a51d01d9f20e97ebb9ac180064c"
      }
    },
    {
      "path": "./docs/assets/readme/coffee-chat-trust.en.png",
      "mode": "100644",
      "engine_audience": "instance",
      "engine_ownership": "source",
      "disposition": "adopt-engine-source",
      "binding": {
        "kind": "content",
        "digest": "sha256:fe668c6c795baeccd1f07fa586d30b4d1d0fcaa7077bba5c47d35f0874bf8df4"
      }
    },
    {
      "path": "./method/shared-method.md",
      "mode": "100644",
      "engine_audience": "instance",
      "engine_ownership": "source",
      "disposition": "adopt-engine-source",
      "binding": {
        "kind": "content",
        "digest": "sha256:776ec1e855fcec8ee5cbf7f37f8f47b2dd56220af9f0b5b9c4a17ee75807d01b"
      }
    },
    {
      "path": "./package-lock.json",
      "mode": "100644",
      "engine_audience": "instance",
      "engine_ownership": "source",
      "disposition": "adopt-engine-source",
      "binding": {
        "kind": "content",
        "digest": "sha256:cec8e9ad863861bc24b72691d43947ba394ed85fa5268fb3cda0f7280e8b339f"
      }
    },
    {
      "path": "./package.json",